{
  "packageFormatVersion": 1,
  "packageId": "com.sleepymario.language.korean",
  "packageVersion": "0.1.0",
  "displayName": "Korean Curriculum",
  "description": "한국어 curriculum content package example.",
  "contentType": "language-curriculum",
  "contentSchemaVersion": "1.0.0",
  "minimumWhackSmackerVersion": "0.1.0",
  "languages": ["ko", "en"],
  "subjects": ["language", "korean"],
  "source": {
    "repository": "https://github.com/SleepyMario/korean-curriculum",
    "commit": "0000000000000000000000000000000000000000"
  },
  "generatedAt": "2026-07-06T00:00:00Z",
  "generator": {
    "name": "whacksmacker-content-builder",
    "version": "0.1.0"
  },
  "entryPoints": [
    {
      "id": "primary",
      "mediaType": "application/json",
      "path": "content/content.json",
      "role": "primary"
    }
  ],
  "dependencies": [
    {
      "packageId": "com.sleepymario.language.linguistic-terminology",
      "version": ">=0.1.0 <1.0.0",
      "optional": true
    }
  ],
  "files": [
    {
      "path": "content/content.json",
      "mediaType": "application/json",
      "size": 0,
      "sha256": "0000000000000000000000000000000000000000000000000000000000000000"
    },
    {
      "path": "docs/license.md",
      "mediaType": "text/markdown",
      "size": 0,
      "sha256": "0000000000000000000000000000000000000000000000000000000000000000"
    }
  ],
  "license": {
    "spdx": null,
    "name": null,
    "path": "docs/license.md"
  }
}
